{
  "sto_version": "1.0.0",
  "released": "2026-07-23",
  "status": "normative",
  "title": "Structural Trustworthiness Ontology",
  "groups": {
    "A": "Deterministic column relations",
    "S": "Sampling and marginal properties",
    "R": "Ordering and cross-split leakage",
    "P": "Predictive shortcuts"
  },
  "dispositions": {
    "target_leakage": "The nominated target is a member of the relation's support; the posed task is answerable by arithmetic over shipped columns.",
    "structural_constraint": "The relation lives entirely among non-target columns (for example physics or accounting); charged to feature redundancy, not to leakage.",
    "redundancy": "A duplicate or near-copy among non-target columns.",
    "not_applicable": "No nominated target (target-free audit), or the class is target-independent."
  },
  "roles": {
    "target": "The nominated benchmark label.",
    "input": "A stochastic feature with no detected artifact role.",
    "derived_deterministic": "A column that is an exact function of other columns.",
    "near_deterministic": "A column predictable out-of-sample beyond the near threshold, not captured by an exact relation.",
    "label_component": "A column that participates in the target's generating relation.",
    "leaky_feature": "A feature (near-)computed from the target (post-outcome) or single-feature dominant.",
    "duplicate": "A duplicate or near-copy of another column.",
    "constant": "A column with a single non-missing value.",
    "identifier": "A near-key column carrying no learnable signal.",
    "datetime": "A timestamp column.",
    "no_signal": "A column with no usable predictive signal."
  },
  "role_precedence": [
    "target",
    "constant",
    "identifier",
    "datetime",
    "duplicate",
    "label_component",
    "derived_deterministic",
    "leaky_feature",
    "near_deterministic",
    "no_signal",
    "input"
  ],
  "reserved_output_symbols": {
    "STO-X00": "Unclassified suspected structure (open world); scored as an abstention, never as a false positive.",
    "ABSTAIN": "An explicit abstention on a column set."
  },
  "compatibility": "Class identifiers are permanent and are never redefined incompatibly. Adding a class is a MINOR ontology change; removing or redefining a class is MAJOR. Deprecated classes are retained with a replacement pointer and the version of deprecation.",
  "extension_policy": "New classes are proposed through the governance change process, must specify every register field and a gold type, and must not overlap an existing class without an explicit relationship note.",
  "classes": [
    {
      "id": "STO-A01",
      "name": "Linear identity",
      "group": "A",
      "gold_type": "objective",
      "definition": "A column is an exact affine function of one or more other columns: a linear combination of the support columns equals a constant on every non-missing row.",
      "scope": "Numeric columns.",
      "inclusion_criteria": "The affine relation holds on all non-missing rows to within the exactness tolerance.",
      "exclusion_criteria": "Relations holding only on a subsample; relations explained by a single duplicated column (use STO-A08); homogeneous sign-only balances (use STO-A02).",
      "example": "cost = power * tariff with a constant tariff.",
      "counterexample": "A noisy regression with residual variance above tolerance.",
      "relationships": ["generalizes STO-A02", "specializes to STO-A08 when the support has size two with unit coefficient"],
      "operating_points": ["tau_exact"],
      "deprecation": null
    },
    {
      "id": "STO-A02",
      "name": "Conservation or balance constraint",
      "group": "A",
      "gold_type": "objective",
      "definition": "A homogeneous linear identity whose coefficients are all in {+1, -1}: a signed sum of columns equal to a constant, typically zero.",
      "scope": "Numeric columns.",
      "inclusion_criteria": "STO-A01 holds and the coefficients are unit-signed.",
      "exclusion_criteria": "General-coefficient linear identities (use STO-A01).",
      "example": "p4 = -(p1 + p2 + p3).",
      "counterexample": "y = 2.5 * x.",
      "relationships": ["subtype of STO-A01"],
      "operating_points": ["tau_exact"],
      "deprecation": null
    },
    {
      "id": "STO-A03",
      "name": "Multiplicative (power-law) identity",
      "group": "A",
      "gold_type": "objective",
      "definition": "A column is an exact product of powers of strictly-positive columns: an affine identity holds in the logarithm of the support.",
      "scope": "Strictly-positive numeric columns.",
      "inclusion_criteria": "The log-space affine relation holds on all non-missing rows to the exactness tolerance.",
      "exclusion_criteria": "Relations requiring non-positive values; additive relations (use STO-A01).",
      "example": "TOTALCOST = BASE_COST * DISPENSES.",
      "counterexample": "y = a*x1 + b*x2.",
      "relationships": ["logarithmic analog of STO-A01"],
      "operating_points": ["tau_exact"],
      "deprecation": null
    },
    {
      "id": "STO-A04",
      "name": "Regime-affine identity",
      "group": "A",
      "gold_type": "objective",
      "definition": "A column equals an affine function of numeric columns plus an additive offset that depends on the level of a categorical column.",
      "scope": "A numeric target column and a low-cardinality categorical regime column.",
      "inclusion_criteria": "After removing per-level means an affine identity holds to the near tolerance and the per-level offsets are non-degenerate.",
      "exclusion_criteria": "A plain STO-A01 that already explains the column without regime offsets.",
      "example": "cooling_eff = base(type) - 0.015 * age.",
      "counterexample": "An affine relation with no categorical dependence.",
      "relationships": ["extends STO-A01 with fixed effects"],
      "operating_points": ["tau_near"],
      "deprecation": null
    },
    {
      "id": "STO-A05",
      "name": "Functional dependency",
      "group": "A",
      "gold_type": "objective",
      "definition": "The value of a discrete column is determined by the value of a determinant column (or minimal set), up to a small violation rate.",
      "scope": "Discrete or categorical columns.",
      "inclusion_criteria": "The g3 violation rate is at most the FD tolerance, the dependent is non-degenerate (modal frequency below the modal cap), and the determinant is not a near-key.",
      "exclusion_criteria": "Dependencies onto near-constant columns (they restate imbalance); key-like determinants.",
      "example": "CODE -> DESCRIPTION.",
      "counterexample": "CODE -> STATUS where STATUS is 99.9 percent one value.",
      "relationships": ["discrete analog of a deterministic relation"],
      "operating_points": ["tau_fd", "tau_modal"],
      "deprecation": null
    },
    {
      "id": "STO-A06",
      "name": "Rule-derived discrete label",
      "group": "A",
      "gold_type": "adjudicated",
      "definition": "A discrete column is, to high fidelity, a deterministic rule (a shallow decision function of thresholds and categories) over other columns.",
      "scope": "Discrete columns with between two and a small number of levels.",
      "inclusion_criteria": "A rule of bounded depth reproduces the column at fidelity at least the rule threshold, removes at least half of the majority-class error, and for near-constant columns only a perfect rule qualifies.",
      "exclusion_criteria": "Fidelity attributable only to class imbalance; exact univariate thresholds (use STO-A07).",
      "example": "Machine failure = rules(TWF, HDF, PWF, OSF).",
      "counterexample": "A label with genuine irreducible noise.",
      "relationships": ["generalizes STO-A07", "adjudicated because the qualifying rule depends on a learned function class"],
      "operating_points": ["tau_rule"],
      "deprecation": null
    },
    {
      "id": "STO-A07",
      "name": "Threshold or sign label",
      "group": "A",
      "gold_type": "objective",
      "definition": "A binary column equals the indicator of a numeric column crossing a fixed threshold (a perfect univariate separation).",
      "scope": "A binary column and a numeric feature.",
      "inclusion_criteria": "The two classes occupy disjoint ranges of the numeric column (a separating threshold exists), each class having at least the minimum count.",
      "exclusion_criteria": "Separations on ultra-rare classes; approximate separations.",
      "example": "stabf == 'unstable' iff stab > 0.",
      "counterexample": "A binary label whose class ranges overlap.",
      "relationships": ["special case of STO-A06 with an exact single-feature threshold"],
      "operating_points": ["tau_mincount"],
      "deprecation": null
    },
    {
      "id": "STO-A08",
      "name": "Duplicate or near-copy column",
      "group": "A",
      "gold_type": "objective",
      "definition": "Two columns are equal up to sign and negligible jitter (correlation magnitude at or above the duplicate threshold), or two non-numeric columns are identical as strings.",
      "scope": "Any columns.",
      "inclusion_criteria": "Correlation magnitude at least the duplicate threshold, or exact string equality.",
      "exclusion_criteria": "Strong-but-imperfect correlation below tolerance.",
      "example": "airflow duplicating fan.",
      "counterexample": "Two correlated but distinct sensors at r = 0.95.",
      "relationships": ["degenerate STO-A01"],
      "operating_points": ["tau_dup"],
      "deprecation": null
    },
    {
      "id": "STO-S01",
      "name": "Duplicate rows",
      "group": "S",
      "gold_type": "objective",
      "definition": "Exact repeated records in the table.",
      "scope": "Whole row; support is the reserved <ROWS> token.",
      "inclusion_criteria": "The duplicate-row fraction exceeds the duplicate-row threshold.",